sku,store_view_code,attribute_set_code,product_type,categories,product_websites,name,weight,product_online,tax_class_name,visibility,price,special_price,url_key,brand,strain,sava_product_type,helps_with,daytime_nightime,cannabinoids,region,psychoactivity,cbd_thc_ratios,terpenes,dose,size,color,scent,flavor,qty,use_config_min_qty,is_qty_decimal,is_in_stock,stock_status,manage_stock,source_tracking_mode,configurable_variations,configurable_variation_labels,associated_skus,intro_text,short_description,description,ingredients,dosing,base_image,small_image,thumbnail_image,additional_images,internal_name,errors
SF2DPRO1,,Concentrates,simple,"Shop/Products/Inhale/Pax Era Pods,Shop/Explore/Cannabinoids/THC,Shop/Explore/Strain/Indica,Shop/Explore/Helps With/Mood,Shop/Explore/Helps With/Sleep,Shop/Explore/Helps With/Muscle pain,Shop/Explore/Helps With/Pain,Shop/Explore/Helps With/Stress,Shop/Explore/Feeling/Nighttime",base,"LA Kush Cake Live Resin Pax Pod",,1,,Catalog,39,,bloom-farms-la-kush-cake-live-resin-pax-pod,"Bloom Farms",Indica,"Pax Era Pods|Vaping","Mood|Sleep|Muscle pain|Pain|Stress",Nighttime,THC,,,,,,,,,,,1,,,,1,None,,,,"A strong indica perfect for rest and relaxation.","<p>LA Kush Cake delivers heavy relaxation that’ll “glue” you to the couch. Contains delicious hints of cake, citrus and spice in its pungent, sour bouquet.</p>","<p>R+R is the name of the game with this strong indica. GG #4 and LA Cake combine to deliver heavy relaxation that’ll “glue” you to the couch and delicious hints of cake, citrus and spice in its pungent, sour bouquet.</p>","<p>Single origin cannabis concentrate</p>","<p>Approximately 81% THC</p>",https://images.ctfassets.net/4a6u5f7bz40f/YTXwscyLfSteMQBlpvAPy/45990b0055ac5c227009e80fc25e5b7a/BF-LAKushCake-pod.jpg,https://images.ctfassets.net/4a6u5f7bz40f/YTXwscyLfSteMQBlpvAPy/45990b0055ac5c227009e80fc25e5b7a/BF-LAKushCake-pod.jpg,https://images.ctfassets.net/4a6u5f7bz40f/YTXwscyLfSteMQBlpvAPy/45990b0055ac5c227009e80fc25e5b7a/BF-LAKushCake-pod.jpg,,"Bloom Farms - LA Kush Cake Live Resin Pax Pod",
S880PRO1,,Concentrates,simple,"Shop/Products/Inhale/Pax Era Pods,Shop/Explore/Cannabinoids/THC,Shop/Explore/Helps With/Anxiety,Shop/Explore/Helps With/Mood,Shop/Explore/Helps With/Stress,Shop/Explore/Feeling/Anytime",base,"Cookie Glue Live Resin Pax Pod",,1,,Catalog,39,,bloom-farms-cookie-glue-live-resin-pax-pod,"Bloom Farms",,"Pax Era Pods|Vaping",Anxiety|Mood|Stress,Anytime,THC,,,,,,,,,,,1,,,,1,None,,,,"A hybrid strain with effects that expand into allover calm and relaxation.","<p>Cookie Glue is a hybrid cross of two legendary strains, GG #4 and GSC. It has a well-balanced flavor of sour, sweet, spicy and fruity notes, while providing equally well-balanced effects.</p>","<p>This hybrid cross of two legendary strains, GG #4 and GSC, results in a tasty treat for all the senses. Its well-balanced flavor includes sour, sweet, spicy and fruity notes, while its equally well-balanced effects are characterized by a slow onset of happiness that expands into allover calm and relaxation.</p>","<p>Single origin cannabis concentrate</p>","<p>Approximately 80% THC</p>",https://images.ctfassets.net/4a6u5f7bz40f/3HwBa90fdM2lix8ZPex33L/009912f818a5f11c6e12f17c091ed8ed/BF-CookieGlue-pod.jpg,https://images.ctfassets.net/4a6u5f7bz40f/3HwBa90fdM2lix8ZPex33L/009912f818a5f11c6e12f17c091ed8ed/BF-CookieGlue-pod.jpg,https://images.ctfassets.net/4a6u5f7bz40f/3HwBa90fdM2lix8ZPex33L/009912f818a5f11c6e12f17c091ed8ed/BF-CookieGlue-pod.jpg,,"Bloom Farms - Cookie Glue Live Resin Pax Pod",
S179PRO1,,Flower,simple,"Shop/Products/Inhale/Pre-Rolls,Shop/Explore/Cannabinoids/THC,Shop/Explore/Cannabinoids/CBD,Shop/Explore/Strain/CBD,Shop/Explore/Helps With/Anxiety,Shop/Explore/Helps With/Mood,Shop/Explore/Helps With/Headache,Shop/Explore/Helps With/Inflammation,Shop/Explore/Helps With/Pain,Shop/Explore/Helps With/Stress,Shop/Explore/Helps With/Athletic Recovery,Shop/Explore/Helps With/Hangover,Shop/Explore/Feeling/Anytime",base,"Coast 2:1 Single Pre-Roll",,1,,Catalog,14,,henrys-original-coast-single-pre-roll,"Henry's Original",CBD,Pre-Rolls,"Anxiety|Mood|Headache|Inflammation|Pain|Stress|Athletic Recovery|Hangover",Anytime,THC|CBD,Mendocino,,,,,,,,,,1,,,,1,None,,,,"Has some psychoactivity while minimizing THC’s unwanted side effects.","<p>Anti-inflammatory, anti-anxiety, anti-nausea. Coast 2:1 produces a calming sensation with reduced anxiety and stress relief.</p>","<p>Anti-inflammatory, anti-anxiety, anti-nausea, has some psychoactivity while minimizing THC’s unwanted side effects. Coast produces a calming sensation with reduced anxiety, stress relief and anti-inflammatory properties. This ratio can act as a pain reliever with the synergistic benefits CBD and THC provide.
Contains 1g per pre-roll.</p>","<p>Pure cannabis flower</p>","<p>10.63% CBD - 1.71% THC</p>",https://images.ctfassets.net/4a6u5f7bz40f/JAK83WQ6EIvYjFvACY3s4/f36eb33f65922772d0637b75be785217/Henrys_PreRoll_Coast_183.jpg,https://images.ctfassets.net/4a6u5f7bz40f/JAK83WQ6EIvYjFvACY3s4/f36eb33f65922772d0637b75be785217/Henrys_PreRoll_Coast_183.jpg,https://images.ctfassets.net/4a6u5f7bz40f/JAK83WQ6EIvYjFvACY3s4/f36eb33f65922772d0637b75be785217/Henrys_PreRoll_Coast_183.jpg,,"Henry's Original - Coast 2:1 Single Pre-Roll",
SFDDPRO1,,Flower,simple,"Shop/Products/Inhale/Pre-Rolls,Shop/Explore/Cannabinoids/THC,Shop/Explore/Strain/Hybrid/Indica-Dominant,Shop/Explore/Helps With/Appetite Stimulation,Shop/Explore/Helps With/Mood,Shop/Explore/Helps With/Headache,Shop/Explore/Helps With/Muscle pain,Shop/Explore/Helps With/Pain",base,"Moonwalker OG Pre-Roll Pack",,1,,Catalog,27,,henrys-original-moonwalker-og-pre-roll-pack,"Henry's Original","Indica-Dominant Hybrid",Pre-Rolls,"Appetite Stimulation|Mood|Headache|Muscle pain|Pain",,THC,Mendocino,,,,,,,,,,1,,,,1,None,,,,"This indica dominant hybrid provides a creative and warming body buzz.","<p>Moonwalker OG is amazing for chronic pain, muscle spasms, and moderate to sever migraines. Smokers beware: munchies are common with this heavy hitter.</p>","<p>Creative and warming full-body buzz, Moonwalker OG is has all the best qualities of an indica dominant hybrid. Amazing for chronic pain, muscle spasms, and moderate to sever migraines. Smokers beware: munchies are common with this heavy hitter.</p>","<p>Pure cannabis flower</p>",,https://images.ctfassets.net/4a6u5f7bz40f/25e2VxDHslHjzMHw2KIpwx/f5564cfe799176d81be6a92319337de7/HenrysOriginal_Generic_PreRolls.jpg,https://images.ctfassets.net/4a6u5f7bz40f/25e2VxDHslHjzMHw2KIpwx/f5564cfe799176d81be6a92319337de7/HenrysOriginal_Generic_PreRolls.jpg,https://images.ctfassets.net/4a6u5f7bz40f/25e2VxDHslHjzMHw2KIpwx/f5564cfe799176d81be6a92319337de7/HenrysOriginal_Generic_PreRolls.jpg,,"Henry's Original - Moonwalker OG Pre-Roll Pack",
C1F0A5PDIEZCUB,,Accessories,simple,Shop/Products/Other/Batteries,base,"Pax Era",,1,,Catalog,30,,pax-era,Pax,,"Pax Era Pods|Vaping Batteries",,,,,,,,,,,,,,1,,,,1,None,,,,"Sleek, discrete vaping device","<p>Device + pod = vape pen. For use with Pax Era Pods.</p>","<p>Compatible with:  - Bloom Farms Pods</p>
<ul>
<li>Bloom Farms Single Origin THC Pods</li>
<li>Bloom Farms Single Origin, CBD Pods</li>
<li>Level Classic THC Pods</li>
<li>Level CBD Pods</li>
</ul>",,,https://images.ctfassets.net/4a6u5f7bz40f/3lHEqF1lt6fX6I3d9bi6Ym/8a83f64c3837cbdc31ea9c4b5d2145d0/pax-era-premium-vaporizer-1270.jpg,https://images.ctfassets.net/4a6u5f7bz40f/3lHEqF1lt6fX6I3d9bi6Ym/8a83f64c3837cbdc31ea9c4b5d2145d0/pax-era-premium-vaporizer-1270.jpg,https://images.ctfassets.net/4a6u5f7bz40f/3lHEqF1lt6fX6I3d9bi6Ym/8a83f64c3837cbdc31ea9c4b5d2145d0/pax-era-premium-vaporizer-1270.jpg,https://images.ctfassets.net/4a6u5f7bz40f/7IyFul4cc0frqtTDy6eWm6/51918ad4cc8f4befef29f4ec72e1103a/pax-era-premium-vaporizer-1276.jpg,"Pax - Pax Era",
SC12PRO2,,Tinctures,simple,"Shop/Products/Ingest/Tincture,Shop/Explore/Cannabinoids/CBD,Shop/Explore/Cannabinoids/CBN,Shop/Explore/Helps With/Anxiety,Shop/Explore/Helps With/Mood,Shop/Explore/Helps With/Headache,Shop/Explore/Helps With/Sleep,Shop/Explore/Helps With/Muscle pain,Shop/Explore/Helps With/Pain,Shop/Explore/Helps With/Stress,Shop/Explore/Feeling/Nighttime",base,"The Remedy CBN:CBD Oil",,1,,"Catalog, Search",77,,marys-medicinals-the-remedy-cbn-cbd-oil,"Mary's Medicinals",,Tincture|Tinctures,"Anxiety|Mood|Headache|Sleep|Muscle pain|Pain|Stress",Nighttime,CBD|CBN,,,,,,,,,,13,1,,1,1,1,None,,,,"Experience body and mind relaxation. May be helpful for those seeking sleep aid.","<p>This sublingual creates the sought-after “entourage effect” and offers a relaxing, soothing effect. The synergistic properties of CBN and CBD may induce sleep and aid in pain management with a minimal psychoactive effect.</p>","<p>This sublingual creates the sought-after “entourage effect” and offers a relaxing, soothing effect in a citrus-vanilla flavor. The synergistic properties of CBN and CBD may induce sleep and aid in pain management with a minimal psychoactive effect.
This 1:1 CBN:CBD sublingual will contain some THC, further enhancing the harmonious synergy between cannabinoids.</p>
<p>This Remedy Oil has been reported to provide relief from neurological/spasmodic symptoms, pain, anxiety/stress, restless leg syndrome, headaches and more.</p>
<p>Vegan, sugar-free, safflower-oil based.</p>","<p>Safflower oil, cannabis extract, citrus flavor, vanilla flavor.</p>","<p>Approximately 400 mg total cannabinoids per container. 1:1 CBN:CBD (200 mg/ each). 1 serving = .25mL = (3.3 mg CBN : 3.3 mg CBD)
Place one to two drops under the tongue as needed.</p>",https://images.ctfassets.net/4a6u5f7bz40f/dWzEH4ge9czpFBfbZTAbq/66c12faa7ac04fe7ce1c8a53c017e67d/MM_Remedy_1-1CBNCBD.jpg,https://images.ctfassets.net/4a6u5f7bz40f/dWzEH4ge9czpFBfbZTAbq/66c12faa7ac04fe7ce1c8a53c017e67d/MM_Remedy_1-1CBNCBD.jpg,https://images.ctfassets.net/4a6u5f7bz40f/dWzEH4ge9czpFBfbZTAbq/66c12faa7ac04fe7ce1c8a53c017e67d/MM_Remedy_1-1CBNCBD.jpg,,"Mary's Medicinals - The Remedy CBN:CBD Oil",
SD05PRO1,,Topicals,simple,"Shop/Products/Rub/Topicals,Shop/Explore/Cannabinoids/CBD,Shop/Explore/Strain/CBD,Shop/Explore/Helps With/Anxiety,Shop/Explore/Helps With/Mood,Shop/Explore/Helps With/Headache,Shop/Explore/Helps With/Inflammation,Shop/Explore/Helps With/Muscle pain,Shop/Explore/Helps With/PMS,Shop/Explore/Helps With/Stress,Shop/Explore/Helps With/Athletic Recovery,Shop/Explore/Helps With/Focus,Shop/Explore/Feeling/Anytime,Shop/Explore/High/Non-Psychoactive",base,"CBD Transdermal Gel Pen",,1,,"Catalog, Search",44,,marys-medicinals-cbd-transdermal-gel-pen,"Mary's Medicinals",CBD,Topical,"Anxiety|Mood|Headache|Inflammation|Muscle pain|PMS|Stress|Athletic Recovery|Focus",Anytime,CBD,,Non-Psychoactive,,,,,,,,10,1,,1,1,1,None,,,,"Eases symptoms of anxiety, reduces inflammation, and promotes focus and balance.","<p>Recommended for users looking for potential relief from issues such as panic attacks, migraine onset, or muscle tremors. inconspicuous, extremely fast-acting, and great for on-the-go use.</p>","<p>Reported to ease the symptoms of anxiety and compulsive disorders, reduce inflammation, promote focus and balancing of homeostasis in the body.</p>","<p>VersaPro, Cannabis Extract, Menthol, Natural Fragrance, Isopropyl Myristate, Natural Terpenes.</p>","<p>Each Gel Pen contains approximately 200 mg of CBD with each dose pump containing approximately 4 mg. Begin with one pump, wait 5-15 minutes for uptake and titrate as needed. 4-6 hour duration of effect.
Uncap the Gel Pen to reveal dispenser end. Gently twist the other end of the Gel Pen to unlock. Gently push down on button to dispense one pump, which is one dose. Gel should be put on the inner wrist, top of the foot or back of the knee for systemic application. Twist button end of the Gel Pen to lock while not in use.</p>",https://images.ctfassets.net/4a6u5f7bz40f/p2NVkndw20QlgvcnddU3E/47189ca844469d90105e2093ecb631b2/MM_Pen_CBD.jpg,https://images.ctfassets.net/4a6u5f7bz40f/p2NVkndw20QlgvcnddU3E/47189ca844469d90105e2093ecb631b2/MM_Pen_CBD.jpg,https://images.ctfassets.net/4a6u5f7bz40f/p2NVkndw20QlgvcnddU3E/47189ca844469d90105e2093ecb631b2/MM_Pen_CBD.jpg,,"Mary's Medicinals - CBD Transdermal Gel Pen",
SAB8PRO1,,Topicals,simple,"Shop/Products/Rub/Topicals,Shop/Explore/Cannabinoids/THC,Shop/Explore/Terpenes/Pinene,Shop/Explore/Terpenes/Caryophyllene,Shop/Explore/Terpenes/Linalool,Shop/Explore/Strain/Indica,Shop/Explore/Helps With/Mood,Shop/Explore/Helps With/Sleep,Shop/Explore/Helps With/Muscle pain,Shop/Explore/Helps With/Pain,Shop/Explore/Helps With/Stress,Shop/Explore/Feeling/Nighttime,Shop/Explore/High/High",base,"Indica Transdermal Patch",,1,,"Catalog, Search",11,,marys-medicinals-indica-transdermal-patch,"Mary's Medicinals",Indica,Topical,"Mood|Sleep|Muscle pain|Pain|Stress",Nighttime,THC,,High,,Pinene|Caryophyllene|Linalool,,,,,,9,1,,1,1,1,None,,,,"A time-release THC effect with a calming and therapeutic blend of terpenes.","<p>Mary's Patches are typically different than competing varieties. Taking effect in 15-30 minutes with a duration of 8-12 hours, these patches provide an even, slow time-release.</p>","<p>A time-release THC effect with a calming and therapeutic blend of terpenes.
Cannabinoids as molecules are too large to permeate beyond the skin, so unless a topically applied cannabis product contains transdermal carriers to break through the stratum corneum (outer layer of skin), topicals are simply skin-deep and local. Transdermal, by definition, is a route of administration wherein active ingredients are delivered across the skin for systemic distribution.</p>
<p>Mary's Patches are typically different than competing varieties. By applying the Transdermal Patches on areas of the body with thin skin and a lot of veins, the cannabis can permeate into the bloodstream for a full body effect similar to smoking or eating edibles. Mary’s patches, which onset in 15-30 minutes and have a duration of between 8 and 12 hours. The effect is an even, slow time-release. Some may feel the patch effects for longer than average, and it’s suggested to leave patches on for approximately 24 hours for the first few uses to gauge effects. We recommend the inside of the wrist, top of the foot or back of the knee for patch placement. Thin skin with a lot of veins is the goal, so that the cannabis oil can transdermally absorb into an advantageous area for systemic. Patches tend to not effect at their full potential if placed on areas not of this nature. For anxiety or a  sore back, it’s best to apply the patch on the inner wrist, etc. It’s important that the area of skin under the patch is cleaned prior to application – either with alcohol or soap and water.</p>
<p>Mary's patches are heat, sweat and water resistant so they will stay in place during active use. Because Mary's patches are made with distillate (other than THCa), the cannabis oil is not visible, slick or likely to cause skin irritation.</p>
<p>Patches can be cut down and micro-dosed without activation so that partials can be saved for later use. When cutting down patches, the dosage will proportionately align, but the 8-12 hour time-frame remains. Our packaging is heat/light resistant, thus, a great place to store unused patches.</p>
<p>An intoxicating effect is possible with Mary's transdermal products. The indica and sativa patches will more than likely cause a “high” feeling. The indica and sativa dominances are created with terpene blends. All of Mary’s patches have a unique and consistent terpene blend that’s been created to best synergize with the featured cannabinoid profile. Our terpenes are naturally derived from non-cannabis botanicals.</p>
<p>Time-release technology – slow and steady, when it hits the bloodstream is a function of skin type and where patch is applied on the body. The patch release is activated when applied to something w/o the formulation.</p>
<p>Being better hydrated allows for systemic transdermal products to be more effective!</p>","<p>Acrylic, glycol, sunflower lecithin, oleic acid, cannabis extract, eucalyptus oil, natural terpenes.</p>","<p>Approximately 20 mg THC per patch. Mary's patches can be cut down, which will proportionately split the dosage while retaining the 8-12 hour time-release. Approximately 30 minute onset.</p>",https://images.ctfassets.net/4a6u5f7bz40f/4N4j6D9nCtUwlF9aHGmcyH/2e8844194121d6914d61ce521a98ced2/MM_Patch_THC-Indica.jpg,https://images.ctfassets.net/4a6u5f7bz40f/4N4j6D9nCtUwlF9aHGmcyH/2e8844194121d6914d61ce521a98ced2/MM_Patch_THC-Indica.jpg,https://images.ctfassets.net/4a6u5f7bz40f/4N4j6D9nCtUwlF9aHGmcyH/2e8844194121d6914d61ce521a98ced2/MM_Patch_THC-Indica.jpg,,"Mary's Medicinals - Indica Transdermal Patch",
S527PRO2,,Topicals,simple,"Shop/Products/Rub/Topicals,Shop/Explore/Cannabinoids/THC,Shop/Explore/Terpenes/Pinene,Shop/Explore/Terpenes/Lymonene,Shop/Explore/Terpenes/Caryophyllene,Shop/Explore/Strain/Sativa,Shop/Explore/Helps With/Mood,Shop/Explore/Helps With/Muscle pain,Shop/Explore/Helps With/Pain,Shop/Explore/Helps With/Energizing,Shop/Explore/Feeling/Daytime,Shop/Explore/High/High",base,"Sativa Transdermal Patch",,1,,"Catalog, Search",11,,marys-medicinals-sativa-transdermal-patch,"Mary's Medicinals",Sativa,Topical,"Mood|Muscle pain|Pain|Energizing",Daytime,THC,,High,,Pinene|Lymonene|Caryophyllene,,,,,,33,1,,1,1,1,None,,,,"THC effects with a stimulating, cerebral and creative blend of added terpenes.","<p>Mary's Patches are typically different than competing varieties. Taking effect in 15-30 minutes with a duration of 8-12 hours, these patches provide an even, slow time-release.</p>","<p>A time-release THC effect with a stimulating, cerebral and creative blend of added terpene effects.
Cannabinoids as molecules are too large to permeate beyond the skin, so unless a topically applied cannabis product contains transdermal carriers to break through the stratum corneum (outer layer of skin), topicals are simply skin-deep and local. Transdermal, by definition, is a route of administration wherein active ingredients are delivered across the skin for systemic distribution.</p>
<p>Mary's Patches are typically different than competing varieties. By applying the Transdermal Patches on areas of the body with thin skin and a lot of veins, the cannabis can permeate into the bloodstream for a full body effect similar to smoking or eating edibles. Mary’s patches, which onset in 15-30 minutes and have a duration of between 8 and 12 hours. The effect is an even, slow time-release. Some may feel the patch effects for longer than average, and it’s suggested to leave patches on for approximately 24 hours for the first few uses to gauge effects. We recommend the inside of the wrist, top of the foot or back of the knee for patch placement. Thin skin with a lot of veins is the goal, so that the cannabis oil can transdermally absorb into an advantageous area for systemic. Patches tend to not effect at their full potential if placed on areas not of this nature. For anxiety or a  sore back, it’s best to apply the patch on the inner wrist, etc. It’s important that the area of skin under the patch is cleaned prior to application – either with alcohol or soap and water.</p>
<p>Mary's patches are heat, sweat and water resistant so they will stay in place during active use. Because Mary's patches are made with distillate (other than THCa), the cannabis oil is not visible, slick or likely to cause skin irritation.</p>
<p>Patches can be cut down and micro-dosed without activation so that partials can be saved for later use. When cutting down patches, the dosage will proportionately align, but the 8-12 hour time-frame remains. Our packaging is heat/light resistant, thus, a great place to store unused patches.</p>
<p>An intoxicating effect is possible with Mary's transdermal products. The indica and sativa patches will more than likely cause a “high” feeling. The indica and sativa dominances are created with terpene blends. All of Mary’s patches have a unique and consistent terpene blend that’s been created to best synergize with the featured cannabinoid profile. Our terpenes are naturally derived from non-cannabis botanicals.</p>
<p>Time-release technology – slow and steady, when it hits the bloodstream is a function of skin type and where patch is applied on the body. The patch release is activated when applied to something w/o the formulation.</p>
<p>Being better hydrated allows for systemic transdermal products to be more effective!</p>","<p>Acrylic, glycol, sunflower lecithin, oleic acid, cannabis extract, eucalyptus oil, natural terpenes.</p>","<p>Approximately 20 mg THC per patch. Mary's patches can be cut down, which will proportionately split the dosage while retaining the 8-12 hour time-release. Approximately 30 minute onset.</p>",https://images.ctfassets.net/4a6u5f7bz40f/6Cjyq4wqwmosRL58mrENwr/1c630b4e12585a7a875573ad6e863f59/MM_Patch_THC-Sativa.jpg,https://images.ctfassets.net/4a6u5f7bz40f/6Cjyq4wqwmosRL58mrENwr/1c630b4e12585a7a875573ad6e863f59/MM_Patch_THC-Sativa.jpg,https://images.ctfassets.net/4a6u5f7bz40f/6Cjyq4wqwmosRL58mrENwr/1c630b4e12585a7a875573ad6e863f59/MM_Patch_THC-Sativa.jpg,,"Mary's Medicinals - Sativa Transdermal Patch",
S069PRO2,,Edibles,simple,"Shop/Products/Ingest/Edibles,Shop/Explore/Cannabinoids/THC,Shop/Explore/Cannabinoids/CBD,Shop/Explore/Helps With/Mood,Shop/Explore/Helps With/Energy,Shop/Explore/Helps With/PMS,Shop/Explore/Helps With/Stress,Shop/Explore/Feeling/Nighttime,Shop/Explore/High/Low",base,"Unwind Black Cherry Mints",,1,,Catalog,19,,plus-unwind-black-cherry-mints,Plus,,Edibles|Sublinguals,Mood|Energy|PMS|Stress,Nighttime,THC|CBD,,Low,,,,,,,,,1,,,,1,None,,,,"Mints with a mellow 9:1 ratio of THC:CBD to help you relax and destress.","<p>Rich, sweet, and slightly tart Black Cherry Mints will help you unwind when life gets hectic. With 2.25 mg THC per mint, find peace of mind throughout the day.</p>","<p>Rich, sweet, and slightly tart Black Cherry Mints will help you unwind when life gets hectic. Find peace of mind with a mellow 9:1 ratio of THC to CBD in each piece.</p>",,"<p>Approximately 0.25 mg CBD - 2.25 mg THC per mint | 10 mg CBD - 90 mg THC per tin. Exact dosing may vary from batch to batch. 40 pieces per container.</p>",https://images.ctfassets.net/4a6u5f7bz40f/P0LmuZpUXRYY4WOC4FXEw/e5bb5b8ec39470b3cab6d64c904632a2/plus_mints_black_cherry.jpg,https://images.ctfassets.net/4a6u5f7bz40f/P0LmuZpUXRYY4WOC4FXEw/e5bb5b8ec39470b3cab6d64c904632a2/plus_mints_black_cherry.jpg,https://images.ctfassets.net/4a6u5f7bz40f/P0LmuZpUXRYY4WOC4FXEw/e5bb5b8ec39470b3cab6d64c904632a2/plus_mints_black_cherry.jpg,,"Plus - Unwind Black Cherry Mints",
SEC8PRO1,,Edibles,simple,"Shop/Products/Ingest/Edibles,Shop/Explore/Cannabinoids/THC,Shop/Explore/Helps With/Mood,Shop/Explore/Helps With/Energy,Shop/Explore/Helps With/Creativity,Shop/Explore/Helps With/Energizing,Shop/Explore/Helps With/Socializing,Shop/Explore/Feeling/Daytime,Shop/Explore/High/Medium",base,"Pride Rainbow Sherbet Gummies",,1,,Catalog,19,,plus-pride-rainbow-sherbet-gummies,Plus,,Edibles,Mood|Energy|Creativity|Energizing|Socializing,Daytime,THC,,Medium,,,,,,,,,1,,,,1,None,,,,"Pride gummies made with an uplifting Sativa blend","<p>Celebrate Pride with PLUS! For every tin sold, PLUS will donate a portion of proceeds to the SF Queer Nightlife Fund, which provides financial relief to nightlife workers who have been impacted as a result of COVID-19</p>","<p>Celebrate Pride with PLUS! Our best-selling limited-edition Pride gummy is back for the 3rd year in a row. Made with an uplifting Sativa blend, each perfectly dosed gummy contains 5 mg of THC. What makes these gummies even sweeter? For every tin sold, PLUS will donate a portion of proceeds to the SF Queer Nightlife Fund, which provides financial relief to nightlife workers who have been impacted as a result of COVID-19. Elevate your mood and join the celebration with this festive limited-edition flavor!</p>",,"<p>Approximately &lt;2 mg CBD - 100 mg THC per tin | &lt;0.1 mg CBD - 5 mg THC per gummy. 20 gummies per package.</p>",https://images.ctfassets.net/4a6u5f7bz40f/6a8zhlItHMSfSitCprEuIq/c8a053cd27dd63cfcd4c4504024c78f5/plus-pride-gummies.jpg,https://images.ctfassets.net/4a6u5f7bz40f/6a8zhlItHMSfSitCprEuIq/c8a053cd27dd63cfcd4c4504024c78f5/plus-pride-gummies.jpg,https://images.ctfassets.net/4a6u5f7bz40f/6a8zhlItHMSfSitCprEuIq/c8a053cd27dd63cfcd4c4504024c78f5/plus-pride-gummies.jpg,,"Plus - Pride Rainbow Sherbet Gummies",
