sku,store_view_code,attribute_set_code,product_type,categories,product_websites,name,weight,product_online,tax_class_name,visibility,price,special_price,url_key,brand,strain,sava_product_type,helps_with,daytime_nightime,cannabinoids,region,psychoactivity,cbd_thc_ratios,terpenes,dose,size,color,scent,flavor,qty,use_config_min_qty,is_qty_decimal,is_in_stock,stock_status,manage_stock,source_tracking_mode,configurable_variations,configurable_variation_labels,associated_skus,intro_text,short_description,description,ingredients,dosing,base_image,small_image,thumbnail_image,additional_images,internal_name,errors
SEA3PRO1,,Flower,simple,"Shop/Products/Inhale/Flower,Shop/Explore/Cannabinoids/THC,Shop/Explore/Strain/Sativa,Shop/Explore/Helps With/Anxiety,Shop/Explore/Helps With/Mood,Shop/Explore/Helps With/Pain,Shop/Explore/Helps With/Stress,Shop/Explore/Helps With/Creativity,Shop/Explore/Helps With/Focus,Shop/Explore/Helps With/Socializing,Shop/Explore/Feeling/Anytime",base,"Chemdawg 91 Flower",,1,,Catalog,33,,henrys-original-chemdawg-91-flower,"Henry's Original",Sativa,Flower,Anxiety|Mood|Pain|Stress|Creativity|Focus|Socializing,Anytime,THC,Mendocino,,,,,,,,,,1,,,,1,None,,,,"A pungent sativa known for a strong diesel nose and potent effects.","<p>Users looking for a respite from pain, stress and anxiety often turn to Chemdawg for quick relief. Chemdawg provides an uplifting high that becomes more cerebral and introspective in the right setting.</p>","<p>The parent of many a favorite strain, Chemdawg is a pungent sativa known for its strong diesel nose, and potent effects. Users looking for a respite from pain, stress and anxiety often turn to Chemdawg for quick relief.</p>","<p>Pure cannabis flower</p>","<p>24.23% THC</p>",https://images.ctfassets.net/4a6u5f7bz40f/1XE9HzwY7yVyyx6oDkq77H/c1e5413499e47d13d54ccc242b188e52/HenrysOriginal_Generic_Flower.jpg,https://images.ctfassets.net/4a6u5f7bz40f/1XE9HzwY7yVyyx6oDkq77H/c1e5413499e47d13d54ccc242b188e52/HenrysOriginal_Generic_Flower.jpg,https://images.ctfassets.net/4a6u5f7bz40f/1XE9HzwY7yVyyx6oDkq77H/c1e5413499e47d13d54ccc242b188e52/HenrysOriginal_Generic_Flower.jpg,,"Henry's Original - Chemdawg 91 Flower",
S2ECPRO1,,Flower,simple,"Shop/Products/Inhale/Flower,Shop/Explore/Cannabinoids/THC,Shop/Explore/Strain/Sativa,Shop/Explore/Helps With/Anxiety,Shop/Explore/Helps With/Mood,Shop/Explore/Helps With/Energy,Shop/Explore/Helps With/Stress,Shop/Explore/Helps With/Creativity,Shop/Explore/Helps With/Focus,Shop/Explore/Helps With/Energizing,Shop/Explore/Helps With/Socializing,Shop/Explore/Feeling/Daytime",base,"Amnesia Haze Flower",,1,,Catalog,33,,henrys-original-amnesia-haze-flower,"Henry's Original",Sativa,Flower,Anxiety|Mood|Energy|Stress|Creativity|Focus|Energizing|Socializing,Daytime,THC,Mendocino,,,,,,,,,,1,,,,1,None,,,,"A bright, citrusy sativa that energizes the mind and promotes creativity.","<p>With notes of Meyer lemon and rich cedar, this strain is great for staying stress-free and productive. Amnesia Haze delivers a happy high that improves mood, and prompts giggles and socialization.</p>","<p>This bright, citrusy sativa strain energizes the mind and promotes creativity.  With notes of meyer lemon and rich cedar, Amnesia Haze delivers a happy high that improves mood, and prompts giggles and socialization.</p>","<p>Pure cannabis flower</p>","<p>24.63% THC</p>",https://images.ctfassets.net/4a6u5f7bz40f/1XE9HzwY7yVyyx6oDkq77H/c1e5413499e47d13d54ccc242b188e52/HenrysOriginal_Generic_Flower.jpg,https://images.ctfassets.net/4a6u5f7bz40f/1XE9HzwY7yVyyx6oDkq77H/c1e5413499e47d13d54ccc242b188e52/HenrysOriginal_Generic_Flower.jpg,https://images.ctfassets.net/4a6u5f7bz40f/1XE9HzwY7yVyyx6oDkq77H/c1e5413499e47d13d54ccc242b188e52/HenrysOriginal_Generic_Flower.jpg,,"Henry's Original - Amnesia Haze Flower",
S33DPRO2,,Flower,simple,"Shop/Products/Inhale/Flower,Shop/Explore/Cannabinoids/THC,Shop/Explore/Terpenes/Myrcene,Shop/Explore/Terpenes/Lymonene,Shop/Explore/Terpenes/Caryophyllene,Shop/Explore/Strain/Hybrid/Indica-Dominant,Shop/Explore/Helps With/Mood,Shop/Explore/Helps With/Sleep,Shop/Explore/Helps With/Pain,Shop/Explore/Helps With/Stress,Shop/Explore/Feeling/Nighttime",base,"Melon Frost 14g Flower Jar",,1,,Catalog,77,,aster-farms-melon-frost-14g-flower-jar,"Aster Farms","Indica-Dominant Hybrid",Flower,Mood|Sleep|Pain|Stress,Nighttime,THC,,,,Myrcene|Lymonene|Caryophyllene,,,,,,,1,,,,1,None,,,,"An indica dominant-hybrid best used in the evenings. Available in a 14g jar.","<p>Melon Frost provides full body relief and relaxation perfect for anytime of day. Contains a sweet scent of candy and berries.</p>","<p>An indica-hybrid with a nose that fills the air with sweet and spicy aroma once the jar is cracked. The dense, resinous buds provide full body relief and relaxation perfect for anytime of day.</p>",,"<p>17% THC</p>",https://images.ctfassets.net/4a6u5f7bz40f/2CaVSbgEUXQPf0vmgTiQ8D/be26d718c8bcbc41adbe54ec46162a3e/Aster-Farms-14gjars.jpg,https://images.ctfassets.net/4a6u5f7bz40f/2CaVSbgEUXQPf0vmgTiQ8D/be26d718c8bcbc41adbe54ec46162a3e/Aster-Farms-14gjars.jpg,https://images.ctfassets.net/4a6u5f7bz40f/2CaVSbgEUXQPf0vmgTiQ8D/be26d718c8bcbc41adbe54ec46162a3e/Aster-Farms-14gjars.jpg,,"Aster Farms - Melon Frost 14g Flower Jar",
S72DPRO1,,Flower,simple,"Shop/Products/Inhale/Flower,Shop/Explore/Cannabinoids/THC,Shop/Explore/Terpenes/Caryophyllene,Shop/Explore/Terpenes/Linalool,Shop/Explore/Terpenes/Humulene,Shop/Explore/Strain/Indica,Shop/Explore/Helps With/Anxiety,Shop/Explore/Helps With/Mood,Shop/Explore/Helps With/Headache,Shop/Explore/Helps With/Pain,Shop/Explore/Helps With/Stress,Shop/Explore/Feeling/Nighttime",base,"Cherry Kola Flower",,1,,Catalog,27,,aster-farms-cherry-kola-flower,"Aster Farms",Indica,Flower,Anxiety|Mood|Headache|Pain|Stress,Nighttime,THC,,,,Caryophyllene|Linalool|Humulene,,,,,,,1,,,,1,None,,,,"An indica leaning hybrid great for winding down after a long day.","<p>Cherry Kola has a distinct flavor of cherries with an earthy undertone. Perfect for those looking for a euphoric, relaxing feeling.</p>","<p>This local strain has a distinct flavor of cherries with an earthy undertone. For those users who are looking for a euphoric, relaxing feeling this is the bud for you.</p>",,"<p>19% THC</p>",https://images.ctfassets.net/4a6u5f7bz40f/61VXOw8Vy2Mzz6dzHMoASf/f618eb8b158ea3aa23e57714975b820a/AsterFarms_GenericJar.jpg,https://images.ctfassets.net/4a6u5f7bz40f/61VXOw8Vy2Mzz6dzHMoASf/f618eb8b158ea3aa23e57714975b820a/AsterFarms_GenericJar.jpg,https://images.ctfassets.net/4a6u5f7bz40f/61VXOw8Vy2Mzz6dzHMoASf/f618eb8b158ea3aa23e57714975b820a/AsterFarms_GenericJar.jpg,,"Aster Farms - Cherry Kola Flower",
S2B7PRO1,,Flower,simple,"Shop/Products/Inhale/Flower,Shop/Explore/Cannabinoids/THC,Shop/Explore/Terpenes/Pinene,Shop/Explore/Terpenes/Myrcene,Shop/Explore/Terpenes/Caryophyllene,Shop/Explore/Strain/Indica,Shop/Explore/Helps With/Anxiety,Shop/Explore/Helps With/Mood,Shop/Explore/Helps With/Inflammation,Shop/Explore/Helps With/Sleep,Shop/Explore/Helps With/Muscle pain,Shop/Explore/Helps With/Pain,Shop/Explore/Helps With/Creativity,Shop/Explore/Helps With/Focus,Shop/Explore/Helps With/Socializing,Shop/Explore/Feeling/Nighttime",base,"Shishkaberry Flower",,1,,Catalog,27,,aster-farms-shishkaberry-flower,"Aster Farms",Indica,Flower,"Anxiety|Mood|Inflammation|Sleep|Muscle pain|Pain|Creativity|Focus|Socializing",Nighttime,THC,,,,Pinene|Myrcene|Caryophyllene,,,,,,,1,,,,1,None,,,,"A strong indica to help you feel sedated and relaxed in the evenings.","<p>This is a strain you need to prepare for, &quot;Kish&quot; is not like the others. This strain will get you social, focused, and cheerful to start, and then have you feeling sedated, relaxed, and dreamy.</p>","<p>This is a strain you need to prepare for, &quot;Kish&quot; is not like the others. This special strain, while at an 80/20 indica, will get you social, focused, and cheerful to start. And then the body low kicks in, feeling sedated, relaxed, and dreamy. Anxiety, arthritic, and insomniacs find the sweet berry and earthy notes compliment each other well.</p>",,"<p>17.6% THC</p>",https://images.ctfassets.net/4a6u5f7bz40f/61VXOw8Vy2Mzz6dzHMoASf/f618eb8b158ea3aa23e57714975b820a/AsterFarms_GenericJar.jpg,https://images.ctfassets.net/4a6u5f7bz40f/61VXOw8Vy2Mzz6dzHMoASf/f618eb8b158ea3aa23e57714975b820a/AsterFarms_GenericJar.jpg,https://images.ctfassets.net/4a6u5f7bz40f/61VXOw8Vy2Mzz6dzHMoASf/f618eb8b158ea3aa23e57714975b820a/AsterFarms_GenericJar.jpg,,"Aster Farms - Shishkaberry Flower",
S4BBPRO1,,Flower,simple,"Shop/Products/Inhale/Flower,Shop/Explore/Cannabinoids/THC,Shop/Explore/Terpenes/Myrcene,Shop/Explore/Terpenes/Lymonene,Shop/Explore/Terpenes/Caryophyllene,Shop/Explore/Strain/Hybrid/Indica-Dominant,Shop/Explore/Helps With/Appetite Stimulation,Shop/Explore/Helps With/Sleep,Shop/Explore/Helps With/Pain,Shop/Explore/Helps With/Stress,Shop/Explore/Feeling/Nighttime",base,"Watermelon OG Flower",,1,,Catalog,27,,aster-farms-watermelon-og-flower,"Aster Farms","Indica-Dominant Hybrid",Flower,"Appetite Stimulation|Sleep|Pain|Stress",Nighttime,THC,,,,Myrcene|Lymonene|Caryophyllene,,,,,,,1,,,,1,None,,,,"Whole cannabis flower available in 1/8ths","<p>An indica with calming and relaxing effects, Watermelon OG works well as a sleeping aid or appetite stimulation. True to its name, this strain has a fruity watermelon flavor profile.</p>","<p>Watermelon OG is our moonlight strain. An indica with calming and relaxing effects, Watermelon OG works well as a sleeping aid or appetite stimulation. True to its name, this strain has a fruity watermelon flavor profile.</p>",,"<p>18.4% THC</p>",https://images.ctfassets.net/4a6u5f7bz40f/7HdgCM5ZkaEjTMHcl7rCYB/f2279ab4d0c29101d1c5f7907288cf5d/AsterFarms_Flower_WatermelonOG_011.jpg,https://images.ctfassets.net/4a6u5f7bz40f/7HdgCM5ZkaEjTMHcl7rCYB/f2279ab4d0c29101d1c5f7907288cf5d/AsterFarms_Flower_WatermelonOG_011.jpg,https://images.ctfassets.net/4a6u5f7bz40f/7HdgCM5ZkaEjTMHcl7rCYB/f2279ab4d0c29101d1c5f7907288cf5d/AsterFarms_Flower_WatermelonOG_011.jpg,https://images.ctfassets.net/4a6u5f7bz40f/77OMeG4h1GKqM9Q7AvJyX0/a1ce924f327a4186df08a4ae41ca33c0/AsterFarms_Flower_WatermelonOG_016.jpg,"Aster Farms - Watermelon OG Flower",
S6C1PRO1,,Flower,simple,"Shop/Products/Inhale/Pre-Rolls,Shop/Explore/Cannabinoids/THC,Shop/Explore/Cannabinoids/CBD,Shop/Explore/Cannabinoids/CBDA,Shop/Explore/Cannabinoids/CBG,Shop/Explore/Cannabinoids/CBC,Shop/Explore/Terpenes/Pinene,Shop/Explore/Terpenes/Myrcene,Shop/Explore/Terpenes/Lymonene,Shop/Explore/Terpenes/Caryophyllene,Shop/Explore/Terpenes/Linalool,Shop/Explore/Terpenes/Humulene,Shop/Explore/Terpenes/Terpinolene,Shop/Explore/Helps With/Aphrodisiac,Shop/Explore/Helps With/Mood,Shop/Explore/Helps With/Stress",base,"Queen-Sized Infused Pre-Rolls",,1,,"Catalog, Search",14,,sexxpot-pre-rolls-queen-sized-infused-pre-rolls,Sexxpot,,Pre-Rolls,Aphrodisiac|Mood|Stress,,THC|CBD|CBDA|CBG|CBC,"Humboldt County",,,Pinene|Myrcene|Lymonene|Caryophyllene|Linalool|Humulene|Terpinolene,,,,,,,1,,,,1,None,,,,"Takes the edge off and sends the body into a relaxed, yet vibrant body flow.","<p>Sexxpot Queen-Sized Infused Prerolls contain a sensual blend of CBD and THC flowers soaked in CBD-rich Cannabis Terpenes. Perfect for any evening when the desire is relaxation.</p>","<p>Sexxpot Queen-Sized Infused Prerolls contain a sensual blend of CBD and THC flowers soaked in CBD-rich Cannabis Terpenes — We call them True Terps. Sexxpot is not just for intimate evenings, it’s perfect for any evening when the desire is relaxation. Sexxpot takes the edge off and sends the body into a relaxed, yet vibrant body flow of sensual delights.
Contains 1.5g per pre-roll.</p>
<p><strong>Additional Information:</strong></p>
<ul>
<li>Sexxpot Queen-Sized Prerolls are women-created, women-approved. Men engage…naturally.</li>
<li>Queen-Size means 3-4x the experience. A little goes a long way.</li>
<li>Our perfect blend of Cannabis CBD:THC and True Terps™ brings on the Entourage Effect, a rich, full-bodied experience.</li>
<li>True Terps™ are made from sun-grown cannabis with safe, state-of-the-art CO2 extraction technology. We call it Awesomesauce!</li>
<li>When Quality Matters – You get the right roll, the right grind, the right effect.</li>
</ul>",,"<p>3.21% CBD – 4.19% THC | 2.55% Terpenes</p>",https://images.ctfassets.net/4a6u5f7bz40f/5iGU8lP8Xz0ghP9imKqh0P/96627bf6bce5aba473b28038277a66ec/SexxPot_PreRoll_091.jpg,https://images.ctfassets.net/4a6u5f7bz40f/5iGU8lP8Xz0ghP9imKqh0P/96627bf6bce5aba473b28038277a66ec/SexxPot_PreRoll_091.jpg,https://images.ctfassets.net/4a6u5f7bz40f/5iGU8lP8Xz0ghP9imKqh0P/96627bf6bce5aba473b28038277a66ec/SexxPot_PreRoll_091.jpg,,"Sexxpot - Queen-Sized Infused Pre-Rolls",
S5A5PRO1,,Flower,simple,"Shop/Products/Inhale/Pre-Rolls,Shop/Explore/Helps With/Anxiety,Shop/Explore/Helps With/Mood,Shop/Explore/Helps With/Sleep,Shop/Explore/Helps With/Stress,Shop/Explore/Feeling/Nighttime",base,"SWOG Pre-Roll Pack",,1,,"Catalog, Search",17,,moon-made-farms-swog-pre-roll-pack,"Moon Made Farms",,Pre-Rolls,Anxiety|Mood|Sleep|Stress,Nighttime,,,,,,,,,,,23,1,,1,1,1,None,,,,"Sun + Earth Certified flower that carries you off into an easy sleep. Three 0.5g pre-rolls per tube.","<p>SWOG is an intense, strong and grounding strain. Perfect for finding your center after a hectic day and easing your nerves.</p>","<p>SWOG is an intense, strong and grounding strain. Perfect for finding your center after a hectic day and easing your nerves. Transporting you deep into the inner realm and carrying you off into an easy sleep. Three 0.5g pre-rolls per tube.
<strong>This product is Sun + Earth Certified. This certification means that this cannabis is grown under the sun, in the soil of mother earth, without chemicals, by fairly paid farmers.</strong></p>",,"<p>16.5% THC</p>",https://images.ctfassets.net/4a6u5f7bz40f/4RUBv1jk8RsMnEWPEZTQQE/8fce04d13ab2bc7d77a3ef6fe9cbad6f/moon-made-farms-3pack-prerolls.jpg,https://images.ctfassets.net/4a6u5f7bz40f/4RUBv1jk8RsMnEWPEZTQQE/8fce04d13ab2bc7d77a3ef6fe9cbad6f/moon-made-farms-3pack-prerolls.jpg,https://images.ctfassets.net/4a6u5f7bz40f/4RUBv1jk8RsMnEWPEZTQQE/8fce04d13ab2bc7d77a3ef6fe9cbad6f/moon-made-farms-3pack-prerolls.jpg,https://images.ctfassets.net/4a6u5f7bz40f/3QaC8aHf0cOh5fY7033bw4/efed345d033faedfecaa745b4f580f4b/Sun_And_Earth_12x12_Centered-01.jpg,"Moon Made Farms - SWOG Pre-Roll Pack",
S2CCPRO2,,Flower,simple,"Shop/Products/Inhale/Pre-Rolls,Shop/Explore/Helps With/Mood,Shop/Explore/Helps With/Energy,Shop/Explore/Helps With/Creativity,Shop/Explore/Helps With/Focus,Shop/Explore/Helps With/Energizing,Shop/Explore/Feeling/Daytime",base,"Cherry Moon Pre-Roll Pack",,1,,"Catalog, Search",22,,moon-made-farms-cherry-moon-pre-roll-pack,"Moon Made Farms",,Pre-Rolls,Mood|Energy|Creativity|Focus|Energizing,Daytime,,,,,,,,,,,20,1,,1,1,1,None,,,,"Sun + Earth Certified flower for clear thinking and motivation. Three 0.5g pre-rolls per tube.","<p>Cherry Moon keeps you up in the sky, on a clear sunny day, riding on pure bliss. It carries notes of sweet candies, cherries &amp; fresh squeezed orange juice, these notes carry ride straight through to your taste buds.</p>","<p>Cherry Moon is a delicious, go-to strain for clear thinking and motivation to keep going when hard work is in your future. Keeps you up in the sky, on a clear sunny day, riding on pure bliss. It carries notes of sweet candies, cherries &amp; fresh squeezed orange juice, these notes carry ride straight through to your taste buds. Three 0.5g pre-rolls per tube.
<strong>This product is Sun + Earth Certified. This certification means that this cannabis is grown under the sun, in the soil of mother earth, without chemicals, by fairly paid farmers.</strong></p>",,"<p>13.55% THC</p>",https://images.ctfassets.net/4a6u5f7bz40f/4RUBv1jk8RsMnEWPEZTQQE/8fce04d13ab2bc7d77a3ef6fe9cbad6f/moon-made-farms-3pack-prerolls.jpg,https://images.ctfassets.net/4a6u5f7bz40f/4RUBv1jk8RsMnEWPEZTQQE/8fce04d13ab2bc7d77a3ef6fe9cbad6f/moon-made-farms-3pack-prerolls.jpg,https://images.ctfassets.net/4a6u5f7bz40f/4RUBv1jk8RsMnEWPEZTQQE/8fce04d13ab2bc7d77a3ef6fe9cbad6f/moon-made-farms-3pack-prerolls.jpg,https://images.ctfassets.net/4a6u5f7bz40f/3QaC8aHf0cOh5fY7033bw4/efed345d033faedfecaa745b4f580f4b/Sun_And_Earth_12x12_Centered-01.jpg,"Moon Made Farms - Cherry Moon Pre-Roll Pack",
S9F3PRO1,,Flower,simple,"Shop/Products/Inhale/Flower,Shop/Explore/Helps With/Mood,Shop/Explore/Helps With/Energy,Shop/Explore/Helps With/Stress,Shop/Explore/Helps With/Creativity,Shop/Explore/Helps With/Focus,Shop/Explore/Helps With/Energizing,Shop/Explore/Helps With/Socializing,Shop/Explore/Feeling/Daytime",base,"Af Berry Flower",,1,,"Catalog, Search",29,,moon-made-farms-af-berry-flower,"Moon Made Farms",,Flower,Mood|Energy|Stress|Creativity|Focus|Energizing|Socializing,Daytime,,,,,,,,,,,27,1,,1,1,1,None,,,,"Sun + Earth Certified flower great for an energy or mood boost during the day.","<p>Af Berry is an easy going strain, best smoked daily to increase daytime focus, creativity, happiness and social connections.</p>","<p>Af Berry is an easy going strain, best smoked daily to increase daytime focus, creativity, happiness and social connections.
<strong>This product is Sun + Earth Certified. This certification means that this cannabis is grown under the sun, in the soil of mother earth, without chemicals, by fairly paid farmers.</strong></p>",,"<p>13.75% THC</p>",https://images.ctfassets.net/4a6u5f7bz40f/4csg1CB32CADwYmMJWc1B4/2f1609342f38a12574da13a836301986/moon-made-farms-flower-jar.jpg,https://images.ctfassets.net/4a6u5f7bz40f/4csg1CB32CADwYmMJWc1B4/2f1609342f38a12574da13a836301986/moon-made-farms-flower-jar.jpg,https://images.ctfassets.net/4a6u5f7bz40f/4csg1CB32CADwYmMJWc1B4/2f1609342f38a12574da13a836301986/moon-made-farms-flower-jar.jpg,https://images.ctfassets.net/4a6u5f7bz40f/3QaC8aHf0cOh5fY7033bw4/efed345d033faedfecaa745b4f580f4b/Sun_And_Earth_12x12_Centered-01.jpg,"Moon Made Farms - Af Berry Flower",
SC4FPRO1,,Flower,simple,"Shop/Products/Inhale/Pre-Rolls,Shop/Explore/Helps With/Anxiety,Shop/Explore/Helps With/Mood,Shop/Explore/Helps With/Stress,Shop/Explore/Helps With/Creativity,Shop/Explore/Feeling/Nighttime",base,"Bonkers Pre-Roll Pack",,1,,"Catalog, Search",17,,moon-made-farms-bonkers-pre-roll-pack,"Moon Made Farms",,Pre-Rolls,Anxiety|Mood|Stress|Creativity,Nighttime,,,,,,,,,,,2,1,,1,1,1,None,,,,"Sun + Earth Certified flower with a euphoric, calming effect. Three 0.5g pre-rolls per tube.","<p>With a sweet lemon citrus and fuel scent, Bonkers is great for slowing down and exploring the internal, a home theater for your mind.</p>","<p>Sweet lemon citrus and fuel, Bonkers has a euphoric, calming effect. Great for slowing down stimulus from the outside world and exploring the internal, a home theater for your mind. Three 0.5g pre-rolls per tube.
<strong>This product is Sun + Earth Certified. This certification means that this cannabis is grown under the sun, in the soil of mother earth, without chemicals, by fairly paid farmers.</strong></p>",,"<p>16.91% THC</p>",https://images.ctfassets.net/4a6u5f7bz40f/4RUBv1jk8RsMnEWPEZTQQE/8fce04d13ab2bc7d77a3ef6fe9cbad6f/moon-made-farms-3pack-prerolls.jpg,https://images.ctfassets.net/4a6u5f7bz40f/4RUBv1jk8RsMnEWPEZTQQE/8fce04d13ab2bc7d77a3ef6fe9cbad6f/moon-made-farms-3pack-prerolls.jpg,https://images.ctfassets.net/4a6u5f7bz40f/4RUBv1jk8RsMnEWPEZTQQE/8fce04d13ab2bc7d77a3ef6fe9cbad6f/moon-made-farms-3pack-prerolls.jpg,https://images.ctfassets.net/4a6u5f7bz40f/3QaC8aHf0cOh5fY7033bw4/efed345d033faedfecaa745b4f580f4b/Sun_And_Earth_12x12_Centered-01.jpg,"Moon Made Farms - Bonkers Pre-Roll Pack",
S4C0PRO3,,Flower,simple,"Shop/Products/Inhale/Flower,Shop/Explore/Helps With/Anxiety,Shop/Explore/Helps With/Mood,Shop/Explore/Helps With/Stress,Shop/Explore/Helps With/Creativity,Shop/Explore/Feeling/Nighttime",base,"Bonkers Flower",,1,,"Catalog, Search",29,,moon-made-farms-bonkers-flower,"Moon Made Farms",,Flower,Anxiety|Mood|Stress|Creativity,Nighttime,,,,,,,,,,,2,1,,1,1,1,None,,,,"Sun + Earth Certified flower with a euphoric, calming effect.","<p>With a sweet lemon citrus and fuel scent, Bonkers is great for slowing down and exploring the internal, a home theater for your mind.</p>","<p>Sweet lemon citrus and fuel, Bonkers has a euphoric, calming effect. Great for slowing down stimulus from the outside world and exploring the internal, a home theater for your mind.
<strong>This product is Sun + Earth Certified. This certification means that this cannabis is grown under the sun, in the soil of mother earth, without chemicals, by fairly paid farmers.</strong></p>",,"<p>17.09% THC</p>",https://images.ctfassets.net/4a6u5f7bz40f/4csg1CB32CADwYmMJWc1B4/2f1609342f38a12574da13a836301986/moon-made-farms-flower-jar.jpg,https://images.ctfassets.net/4a6u5f7bz40f/4csg1CB32CADwYmMJWc1B4/2f1609342f38a12574da13a836301986/moon-made-farms-flower-jar.jpg,https://images.ctfassets.net/4a6u5f7bz40f/4csg1CB32CADwYmMJWc1B4/2f1609342f38a12574da13a836301986/moon-made-farms-flower-jar.jpg,https://images.ctfassets.net/4a6u5f7bz40f/3QaC8aHf0cOh5fY7033bw4/efed345d033faedfecaa745b4f580f4b/Sun_And_Earth_12x12_Centered-01.jpg,"Moon Made Farms - Bonkers Flower",
S819PRO1,,Flower,simple,"Shop/Products/Inhale/Pre-Rolls,Shop/Explore/Strain/Hybrid/Balanced,Shop/Explore/Helps With/Mood,Shop/Explore/Helps With/Stress,Shop/Explore/Helps With/Creativity,Shop/Explore/Helps With/Focus,Shop/Explore/Feeling/Anytime",base,"Sapphire-Tsu Pre-Roll Pack",,1,,"Catalog, Search",22,,moon-made-farms-sapphire-tsu-pre-roll-pack,"Moon Made Farms","Balanced Hybrid",Pre-Rolls,Mood|Stress|Creativity|Focus,Anytime,,,,2:1,,,,,,,14,1,,1,1,1,None,,,,"Sun + Earth Certified flower with a 2:1 CBD:THC ratio. Three 0.5g pre-rolls per tube.","<p>Sapphire-Tsu provides a unique high characterized by clarity, inspiration, and a cool chilled out vibe that persists with light touch. The CBD makes it accessible without the &quot;forcing&quot; the experience of relaxation.</p>","<p>A cross between Sapphire Harle Tsu X Sapphire Scout with a taste and smell of soothing smooth sweet pine and clove.
2:1 CBD balanced hybrid with 60/40 sativa-dominant characteristics. A unique high characterized by clarity, inspiration, and a cool chilled out vibe that persists with light touch. The influence of the Sour Scout is there but without any stoniness leaving a balanced cannabinoid relief from the start with a focused inspiring edge to the high that comes and goes as you tune into it. The CBD makes it accessible without the &quot;forcing&quot; the experience of relaxation. Three 0.5g pre-rolls per tube.</p>
<p><strong>This product is Sun + Earth Certified. This certification means that this cannabis is grown under the sun, in the soil of mother earth, without chemicals, by fairly paid farmers.</strong></p>",,"<p>14.41% CBD - 4.116% THC</p>",https://images.ctfassets.net/4a6u5f7bz40f/4RUBv1jk8RsMnEWPEZTQQE/8fce04d13ab2bc7d77a3ef6fe9cbad6f/moon-made-farms-3pack-prerolls.jpg,https://images.ctfassets.net/4a6u5f7bz40f/4RUBv1jk8RsMnEWPEZTQQE/8fce04d13ab2bc7d77a3ef6fe9cbad6f/moon-made-farms-3pack-prerolls.jpg,https://images.ctfassets.net/4a6u5f7bz40f/4RUBv1jk8RsMnEWPEZTQQE/8fce04d13ab2bc7d77a3ef6fe9cbad6f/moon-made-farms-3pack-prerolls.jpg,https://images.ctfassets.net/4a6u5f7bz40f/3QaC8aHf0cOh5fY7033bw4/efed345d033faedfecaa745b4f580f4b/Sun_And_Earth_12x12_Centered-01.jpg,"Moon Made Farms - Sapphire-Tsu Pre-Roll Pack",
SF40PRO2,,Flower,simple,"Shop/Products/Inhale/Flower,Shop/Explore/Cannabinoids/THC,Shop/Explore/Terpenes/Pinene,Shop/Explore/Terpenes/Myrcene,Shop/Explore/Terpenes/Lymonene,Shop/Explore/Terpenes/Caryophyllene,Shop/Explore/Terpenes/Ocimene,Shop/Explore/Helps With/Mood,Shop/Explore/Helps With/Energy,Shop/Explore/Helps With/Creativity,Shop/Explore/Helps With/Focus,Shop/Explore/Helps With/Energizing,Shop/Explore/Feeling/Daytime",base,"Cherry Moon Flower",,1,,"Catalog, Search",33,,moon-made-farms-cherry-moon-flower,"Moon Made Farms",,Flower,Mood|Energy|Creativity|Focus|Energizing,Daytime,THC,,,,Pinene|Myrcene|Lymonene|Caryophyllene|Ocimene,,,,,,7,1,,1,1,1,None,,,,"Sun + Earth Certified flower for clear thinking and motivation.","<p>Cherry Moon keeps you up in the sky, on a clear sunny day, riding on pure bliss. It carries notes of sweet candies, cherries &amp; fresh squeezed orange juice, these notes carry ride straight through to your taste buds.</p>","<p>Cherry Moon is a delicious, go-to strain for clear thinking and motivation to keep going when hard work is in your future. Keeps you up in the sky, on a clear sunny day, riding on pure bliss. It carries notes of sweet candies, cherries &amp; fresh squeezed orange juice, these notes carry ride straight through to your taste buds.
<strong>This product is Sun + Earth Certified. This certification means that this cannabis is grown under the sun, in the soil of mother earth, without chemicals, by fairly paid farmers.</strong></p>",,"<p>22.24% THC</p>",https://images.ctfassets.net/4a6u5f7bz40f/4csg1CB32CADwYmMJWc1B4/2f1609342f38a12574da13a836301986/moon-made-farms-flower-jar.jpg,https://images.ctfassets.net/4a6u5f7bz40f/4csg1CB32CADwYmMJWc1B4/2f1609342f38a12574da13a836301986/moon-made-farms-flower-jar.jpg,https://images.ctfassets.net/4a6u5f7bz40f/4csg1CB32CADwYmMJWc1B4/2f1609342f38a12574da13a836301986/moon-made-farms-flower-jar.jpg,https://images.ctfassets.net/4a6u5f7bz40f/3QaC8aHf0cOh5fY7033bw4/efed345d033faedfecaa745b4f580f4b/Sun_And_Earth_12x12_Centered-01.jpg,"Moon Made Farms - Cherry Moon Flower",
