sku,store_view_code,attribute_set_code,product_type,categories,product_websites,name,weight,product_online,tax_class_name,visibility,price,special_price,url_key,brand,strain,sava_product_type,helps_with,daytime_nightime,cannabinoids,region,psychoactivity,cbd_thc_ratios,terpenes,dose,size,color,scent,flavor,qty,use_config_min_qty,is_qty_decimal,is_in_stock,stock_status,manage_stock,source_tracking_mode,configurable_variations,configurable_variation_labels,associated_skus,intro_text,short_description,description,ingredients,dosing,base_image,small_image,thumbnail_image,additional_images,internal_name,errors
SF23PRO1,,Edibles,simple,"Shop/Products/Ingest/Edibles,Shop/Explore/Cannabinoids/THC,Shop/Explore/Helps With/Mood,Shop/Explore/Helps With/Energy,Shop/Explore/Helps With/Creativity,Shop/Explore/Helps With/Focus,Shop/Explore/Helps With/Energizing,Shop/Explore/Helps With/Socializing,Shop/Explore/Feeling/Daytime,Shop/Explore/High/Medium",base,"Buzz Cannabis-Infused Botanical Mints",,1,,"Catalog, Search",20,,kikoko-buzz-mints,Kikoko,,Edibles|Sublinguals,Mood|Energy|Creativity|Focus|Energizing|Socializing,Daytime,THC,,Medium,,,,,,,,20,1,,1,1,1,None,,,,"Contains 5 mg of THC and Vitamin D for you to get more sunshine in your life.","<p>Kikoko Buzz Mints provides a lovely, uplifting, mild high and the watermelon and mint flavor tastes like summer all year long. Has a mild to moderate high for most people.</p>","<p>With 5 mg of THC and a daily dose of Vitamin D, you get more sunshine in your life than on cloudy days. The 5 mg of THC is a lovely, uplifting, mild high and the watermelon and mint flavor tastes like summer all year long. Little Helpers BUZZ has a mild to moderate high for most people.</p>","<p>Vitamin D3, black pepper extract, beet, xylitol, watermelon extract, vanilla extract, menthol crystals, basil, stevia extract, magnesium stearate, silicon dioxide, polydextrose, cannabis extract.</p>","<p>Approximately 5 mg THC per serving | 100 mg THC per package. 20 mints per package.</p>",https://images.ctfassets.net/4a6u5f7bz40f/7ndGhNvkxq0HcQr25A0720/d34a7bc46e2fd8cda4eadfe4c06930e0/kikoko-buzz-mints.jpg,https://images.ctfassets.net/4a6u5f7bz40f/7ndGhNvkxq0HcQr25A0720/d34a7bc46e2fd8cda4eadfe4c06930e0/kikoko-buzz-mints.jpg,https://images.ctfassets.net/4a6u5f7bz40f/7ndGhNvkxq0HcQr25A0720/d34a7bc46e2fd8cda4eadfe4c06930e0/kikoko-buzz-mints.jpg,,"Kikoko - Buzz Cannabis-Infused Botanical Mints",
321136VGDKMWDE,,Edibles,simple,"Shop/Products/Ingest/Edibles,Shop/Explore/Cannabinoids/THC,Shop/Explore/Helps With/Cold & Flu Relief,Shop/Explore/Helps With/Mood,Shop/Explore/Helps With/Energy,Shop/Explore/Helps With/Headache,Shop/Explore/Helps With/Inflammation,Shop/Explore/Helps With/Pain,Shop/Explore/Helps With/PMS,Shop/Explore/Helps With/Skin Care,Shop/Explore/Helps With/Stress,Shop/Explore/Helps With/Energizing,Shop/Explore/Helps With/Socializing,Shop/Explore/Feeling/Anytime",base,"HoneyShot BUZZ",,1,,"Catalog, Search",7,,kikoko-honeyshot-buzz,Kikoko,,Edibles,"Cold & Flu Relief|Mood|Energy|Headache|Inflammation|Pain|PMS|Skin Care|Stress|Energizing|Socializing",Anytime,THC,,,,,,,,,,22,1,,1,1,1,None,,,,"Manuka honey stick with THC","<p>In addition to offering antibacterial and anti-inflammatory properties, this honey is delicious and will get you nicely high, all while annihilating nasty bacteria.</p>","<p>In addition to offering antibacterial and anti-inflammatory properties, the BUZZ HoneyShot is delicious and will get you nicely high, all while annihilating nasty bacteria. What could be better?
Each HoneyShot pouch holds 1 biodegradable honey stick.</p>","<p>Manuka Honey, Cannabis Oil
Our Manuka honey contains:</p>
<ul>
<li>DHA, an omega fatty acid essential for brain health.</li>
<li>Magnesium, which is vital for bone health and great for migraines, diabetes, anxiety, sleep, and PMS.</li>
<li>Leptosin, which has antibacterial and antiviral properties.</li>
</ul>","<p>Approximately 0 mg CBD - 10mg THC per serving (per package)
<strong>Suggested Use:</strong></p>
<ul>
<li>Consume straight from the straw; compost when done.</li>
<li>Add to smoothies, juice, hot and cold drinks, toast, cereal or whatever!</li>
<li>Honey is a humectant (i.e. it seals moisture within the skin), so it’s perfect for use in face masks or applied directly to skin.</li>
</ul>",https://images.ctfassets.net/4a6u5f7bz40f/2chDMVckWP5IZXYAiXjV9O/2eb45f1f2fbf5593e4a600a3cc0b5be6/Kikoko_Buzz_HoneyShot_1080px.jpg,https://images.ctfassets.net/4a6u5f7bz40f/2chDMVckWP5IZXYAiXjV9O/2eb45f1f2fbf5593e4a600a3cc0b5be6/Kikoko_Buzz_HoneyShot_1080px.jpg,https://images.ctfassets.net/4a6u5f7bz40f/2chDMVckWP5IZXYAiXjV9O/2eb45f1f2fbf5593e4a600a3cc0b5be6/Kikoko_Buzz_HoneyShot_1080px.jpg,,"Kikoko - HoneyShot BUZZ",
S268PRO1,,Edibles,simple,"Shop/Products/Ingest/Edibles,Shop/Explore/Cannabinoids/THC,Shop/Explore/Cannabinoids/THCV,Shop/Explore/Helps With/Mood,Shop/Explore/Helps With/Energy,Shop/Explore/Helps With/Stress,Shop/Explore/Helps With/Creativity,Shop/Explore/Helps With/Focus,Shop/Explore/Helps With/Energizing,Shop/Explore/Helps With/Socializing,Shop/Explore/Feeling/Daytime,Shop/Explore/High/Low",base,"Boost Cannabis-Infused Botanical Mints",,1,,"Catalog, Search",33,,kikoko-boost-mints,Kikoko,,Edibles|Sublinguals,Mood|Energy|Stress|Creativity|Focus|Energizing|Socializing,Daytime,THC|THCV,,Low,,,,,,,,,1,,,,1,None,,,,"Coconut yuzu flavored mints for an energetic mood lift.","<p>One Boost mint creates a fully functioning feeling of pleasure, two gives a motivating high. A rare and precious cannabinoid, THCV is known to promote energy and clarity, and when paired with a little THC, a vital, happy feeling.</p>","<p>A rare and precious cannabinoid, THCV is known to promote energy and clarity, and when paired with a little THC, a vital, happy feeling. One mint creates a fully functioning feeling of pleasure, two gives a motivating high. There is also some research showing that THCV can suppress appetite and is excellent for pain. We also added a touch of matcha, a green tea extract that’s high in antioxidants and boosts energy.
Net Wt. = 14 g (0.5 oz)</p>","<p>Yuzu, matcha, coconut, turmeric, black pepper extract, malic acid, poludextrose, xylitol, magnesium stearate, silicon dioxide, stevia extract, non-hydrogenated palm oil, cannabis extract.</p>","<p>Approximately 2.5 mg THC - 2.5 mg THCV per serving (1 mint) | 100 mg THC per package. 20 mints per package.</p>",https://images.ctfassets.net/4a6u5f7bz40f/3BpG3MspjHooWEjpXfYUMx/66035c1d4b6c136b3905257800bf6eb6/kikoko-boost-mints.jpg,https://images.ctfassets.net/4a6u5f7bz40f/3BpG3MspjHooWEjpXfYUMx/66035c1d4b6c136b3905257800bf6eb6/kikoko-boost-mints.jpg,https://images.ctfassets.net/4a6u5f7bz40f/3BpG3MspjHooWEjpXfYUMx/66035c1d4b6c136b3905257800bf6eb6/kikoko-boost-mints.jpg,,"Kikoko - Boost Cannabis-Infused Botanical Mints",
EC1D1EYNKX3K5O,,Tinctures,simple,"Shop/Products/Ingest/Tincture,Shop/Explore/Cannabinoids/THC,Shop/Explore/Cannabinoids/CBD,Shop/Explore/Strain/CBD,Shop/Explore/Helps With/Cold & Flu Relief,Shop/Explore/Helps With/Mood,Shop/Explore/Helps With/Inflammation,Shop/Explore/Helps With/Muscle pain,Shop/Explore/Helps With/Nerve pain,Shop/Explore/Helps With/Pain,Shop/Explore/Helps With/PMS,Shop/Explore/Helps With/Stress,Shop/Explore/Feeling/Anytime,Shop/Explore/High/Low",base,"No. 3 CBD Rich Tincture",,1,,"Catalog, Search",55,,rosette-no-3-cbd-rich-tincture,Rosette,CBD,Tincture,"Cold & Flu Relief|Mood|Inflammation|Muscle pain|Nerve pain|Pain|PMS|Stress",Anytime,THC|CBD,"Humboldt County",Low,3:1,,,,,,,,1,,,,1,None,,,,"3:1 CBD-rich blend","<p>This CBD to THC ratio provides a powerful yet yielding treatment option to relieve symptoms for a variety of conditions.</p>","<p>The Rosette Wellness No.3 CBD Rich Cannabis Tincture is formulated to provide an approximate 3 to 1 dose of CBD to THC. This cannabis tincture provides a powerful yet yielding treatment option to relieve symptoms of arthritis, cancer treatment support, chronic pain symptoms, and so many more.
Our tinctures are made with our specially formulated full plant extract combined with MCT (medium chain triglyceride) oil made from coconuts. MCT oil has nutritional benefits, is easy to digest and is rapidly absorbed by the body. Blending the MCT with our extract also produces a very even tincture because of the compatible molecule size, so the first dropper has the same cannabinoid content as the last. No shaking required.</p>
<p>Only top shelf cannabis flowers are used in our proprietary extraction process. Top shelf flower has the widest and densest cannabinoid, sub-cannabinoid and terpene content available on the plant. We do not use shake, trim, or low-quality bud/flower for our extractions or products, only premium buds. We grow our own proprietary strains naturally under the Humboldt sun.</p>","<p>MCT oil, whole flower full spectrum cannabis extract</p>","<p>For best results, take under the tongue 3x a day with meals. Slowly titrate up to find your lowest dose. This tincture can also be used topically.
1 oz bottle = 143 servings  | 250 mg CBD + 107 mg THC = 357 mg cannabinoids | 12 mg of cannabinoids per dropper</p>",https://images.ctfassets.net/4a6u5f7bz40f/7kHJtZgNO4zy6kH9waX0Lw/dc9611840cc5060bb57ced0bc10c35a4/rosette-no3-update.jpg,https://images.ctfassets.net/4a6u5f7bz40f/7kHJtZgNO4zy6kH9waX0Lw/dc9611840cc5060bb57ced0bc10c35a4/rosette-no3-update.jpg,https://images.ctfassets.net/4a6u5f7bz40f/7kHJtZgNO4zy6kH9waX0Lw/dc9611840cc5060bb57ced0bc10c35a4/rosette-no3-update.jpg,,"Rosette - No. 3 CBD Rich Tincture",
9D3028IPY1105V,,Tinctures,simple,"Shop/Products/Ingest/Tincture,Shop/Explore/Cannabinoids/THC,Shop/Explore/Cannabinoids/CBD,Shop/Explore/Helps With/Appetite Stimulation,Shop/Explore/Helps With/Arthritis,Shop/Explore/Helps With/Cold & Flu Relief,Shop/Explore/Helps With/Mood,Shop/Explore/Helps With/Headache,Shop/Explore/Helps With/Inflammation,Shop/Explore/Helps With/Sleep,Shop/Explore/Helps With/Muscle pain,Shop/Explore/Helps With/Nerve pain,Shop/Explore/Helps With/Pain,Shop/Explore/Helps With/PMS,Shop/Explore/Helps With/Stress,Shop/Explore/Feeling/Anytime,Shop/Explore/High/Medium",base,"No. 1 CBD Rich Tincture",,1,,"Catalog, Search",55,,rosette-no-1-cbd-rich-tincture,Rosette,,Tincture,"Appetite Stimulation|Arthritis|Cold & Flu Relief|Mood|Headache|Inflammation|Sleep|Muscle pain|Nerve pain|Pain|PMS|Stress",Anytime,THC|CBD,"Humboldt County",Medium,1:1,,,,,,,18,1,,1,1,1,None,,,,"1:1 balanced blend","<p>Formulated to provide a harmonious blend of both CBD and THC, this tincture provides a powerful treatment option to relieve symptoms from a variety of conditions.</p>","<p>Our No.1 CBD Rich Cannabis Tincture is formulated to provide a harmonious blend of both CBD and THC. This cannabis tincture provides a powerful treatment option to relieve symptoms for a variety of conditions such as cancer treatment support,  headaches, muscle and nerve pain, plus so many more.
Our tinctures are made with our specially formulated full plant extract combined with MCT (medium chain triglyceride) oil made from coconuts. MCT oil has nutritional benefits, is easy to digest and is rapidly absorbed by the body. Blending the MCT with our extract also produces a very even tincture because of the compatible molecule size, so the first dropper has the same cannabinoid content as the last. No shaking required.</p>
<p>Only top shelf cannabis flowers are used in our proprietary extraction process. Top shelf flower has the widest and densest cannabinoid, sub-cannabinoid and terpene content available on the plant. We do not use shake, trim, or low quality bud/flower our extractions or products. We grow our own proprietary strains naturally under the Humboldt sun.</p>","<p>MCT oil, whole flower full spectrum cannabis extract</p>","<p>For best results, take under the tongue 3x a day with meals. Slowly titrate up to find your lowest dose. This tincture can also be used topically.
1 oz bottle = 150 servings | 171 mg CBD + 206 mg THC = 377 mg cannabinoids | 13 mg of cannabinoids per dropper</p>",https://images.ctfassets.net/4a6u5f7bz40f/1pZ5UcAvgnnbG45TUSnG4e/2418b749e7507b0e17c84286a7737b2f/rosette-no1-update.jpg,https://images.ctfassets.net/4a6u5f7bz40f/1pZ5UcAvgnnbG45TUSnG4e/2418b749e7507b0e17c84286a7737b2f/rosette-no1-update.jpg,https://images.ctfassets.net/4a6u5f7bz40f/1pZ5UcAvgnnbG45TUSnG4e/2418b749e7507b0e17c84286a7737b2f/rosette-no1-update.jpg,,"Rosette - No. 1 CBD Rich Tincture","Url key: 'rosette-no-1-cbd-rich-tincture.html' was already generated for an item with the SKU: 'rosette-no-1-cbd-rich-tincture'. You need to specify the unique URL key manually"
SB30PRO1,,Tinctures,simple,"Shop/Products/Ingest/Tincture,Shop/Explore/Cannabinoids/THC,Shop/Explore/Cannabinoids/CBD,Shop/Explore/Terpenes/Caryophyllene,Shop/Explore/Helps With/Appetite Stimulation,Shop/Explore/Helps With/Inflammation,Shop/Explore/Helps With/Muscle pain,Shop/Explore/Helps With/Nerve pain,Shop/Explore/Helps With/Pain,Shop/Explore/Feeling/Anytime,Shop/Explore/High/Medium",base,"The Remedy 1:1 CBD:THC Oil",,1,,"Catalog, Search",55,,marys-medicinals-the-remedy-1-1-cbd-thc-oil,"Mary's Medicinals",,Tincture,"Appetite Stimulation|Inflammation|Muscle pain|Nerve pain|Pain",Anytime,THC|CBD,,Medium,,Caryophyllene,,,,,,16,1,,1,1,1,None,,,,"Gentle 1:1 tincture to help ease gastrointestinal irritation, pain, and inflammation.","<p>The Remedy by Coltyn’s 1:1 ratio can be suggested for a multitude of consumers seeking the entourage effect of THC and CBD. Mary's and Coltyn collaborated on The Remedy by Coltyn to provide a product for those dealing with GI sensitivities</p>","<p>The Remedy by Coltyn’s namesake, Coltyn Turner, suffered from debilitating Crohn’s disease and Lupus. Coltyn, who was one of the first pediatric medical cannabis patients, and his family moved from their home-state of Illinois to Colorado for access to medical cannabis. Seeking relief using sublingual products, Coltyn often experienced gastrointestinal irritation and Chron’s flare ups due to the food ingredients. This inspired Wendy Turner, Coltyn’s mother, to begin crafting her own sublingual blends to find what would be most gentle and effective for her son. Wendy discovered that safflower oil, a close cousin of sunflower oil, served as incredible carrier oil for cannabis and, alternatively, did not cause Coltyn any distressing GI discomfort.
All the while, Coltyn, a fearless young advocate, built an incredible network called Coltyn’s Crue to support and bring together those suffering from similar health problems. As one of the first pediatric medical cannabis patients, Coltyn went into full remission from Crohn’s disease using only cannabis and continues to advocate for what helped him become “illegally healed”.</p>
<p>Mary's and Coltyn collaborated on The Remedy by Coltyn to provide a product for those dealing with GI sensitivities. This sublingual is formulated to be gentle on the GI-tract, intentionally using safflower-oil as the base, no flavors and Beta-Caryophyllene for its gut-protectant qualities.</p>
<p>Proceeds from the sale of The Remedy by Coltyn go towards finding a cure for Crohn’s disease. https://www.thecoltynturnerfoundation.org/</p>
<p>The Remedy by Coltyn’s 1:1 ratio can be suggested for a multitude of consumers seeking the entourage effect of THC and CBD. The ingredient list and formulation is what makes this product unique!</p>","<p>Safflower Oil, Cannabis Extract, Beta-Caryophyllene.</p>","<p>Approximately 600 mg per container, 300 mg CBD - 300 mg THC
25 mL (1 serving) = 10 mg total (5 mg CBD - 5 mg THC)</p>
<p>Place one to two drops under the tongue as needed.</p>",https://images.ctfassets.net/4a6u5f7bz40f/5uMcpOuNgf4VNM30PC4MbV/916d540edb536221d40d3a3f5a271899/MM_Remedy_1.1Coltyn.jpg,https://images.ctfassets.net/4a6u5f7bz40f/5uMcpOuNgf4VNM30PC4MbV/916d540edb536221d40d3a3f5a271899/MM_Remedy_1.1Coltyn.jpg,https://images.ctfassets.net/4a6u5f7bz40f/5uMcpOuNgf4VNM30PC4MbV/916d540edb536221d40d3a3f5a271899/MM_Remedy_1.1Coltyn.jpg,,"Mary's Medicinals - The Remedy 1:1 CBD:THC Oil",
S684PRO1,,Tinctures,simple,"Shop/Products/Ingest/Tincture,Shop/Explore/Cannabinoids/THC,Shop/Explore/Helps With/Appetite Stimulation,Shop/Explore/Helps With/Sleep,Shop/Explore/Helps With/Muscle pain,Shop/Explore/Helps With/Nerve pain,Shop/Explore/Helps With/Pain,Shop/Explore/Helps With/Stress,Shop/Explore/Feeling/Nighttime,Shop/Explore/High/High",base,"The Remedy THC Oil",,1,,"Catalog, Search",55,,marys-medicinals-the-remedy-thc-oil,"Mary's Medicinals",,Tincture|Tinctures,"Appetite Stimulation|Sleep|Muscle pain|Nerve pain|Pain|Stress",Nighttime,THC,,High,,,,,,,,19,1,,1,1,1,None,,,,"THC tincture that treats stress, pain, and appetite loss.","<p>This sublingual, lovingly known as “the thousie” is Mary’s top-selling product. Affordably-priced and packed with 1000 mg of THC, this sublingual is also vegan and sugar-free.</p>","<p>This sublingual, lovingly known as “the thousie” is Mary’s top-selling product. Affordably-priced and packed with 1000 mg of THC, this sublingual is also vegan and sugar-free.
Safflower-oil based, lemon and lime flavored. One .25mL serving is 16.7 mg THC.</p>
<p>The Remedy has been reported to be helpful with appetite stimulation, stress relief, nausea relief, relief from neurological/spasmodic symptoms, pain and more. Contains intoxicating, potent, hybrid effects. We recommend starting low and slow.</p>","<p>Safflower oil, cannabis extract, lemon/lime flavoring.</p>","<p>Approximately 1000 mg THC per container. One .25 mL serving contains approximately 16.7 mg THC.
Place one to two drops under the tongue as needed.</p>",https://images.ctfassets.net/4a6u5f7bz40f/1wVwGCT6MzqcMc3X2Lltws/3269fb27e09fbcb319824b84615967ba/MM_Remedy_THC.jpg,https://images.ctfassets.net/4a6u5f7bz40f/1wVwGCT6MzqcMc3X2Lltws/3269fb27e09fbcb319824b84615967ba/MM_Remedy_THC.jpg,https://images.ctfassets.net/4a6u5f7bz40f/1wVwGCT6MzqcMc3X2Lltws/3269fb27e09fbcb319824b84615967ba/MM_Remedy_THC.jpg,,"Mary's Medicinals - The Remedy THC Oil",
S7E2PRO1,,Tinctures,simple,"Shop/Products/Ingest/Tincture,Shop/Explore/Cannabinoids/THC,Shop/Explore/Cannabinoids/CBD,Shop/Explore/Helps With/Anxiety,Shop/Explore/Helps With/Mood,Shop/Explore/Helps With/Inflammation,Shop/Explore/Helps With/Muscle pain,Shop/Explore/Helps With/Pain,Shop/Explore/Helps With/Skin Care,Shop/Explore/Helps With/Stress,Shop/Explore/Feeling/Anytime,Shop/Explore/High/Low",base,"The Remedy CBD Oil",,1,,"Catalog, Search",55,,marys-medicinals-the-remedy-cbd-oil,"Mary's Medicinals",,Tincture,"Anxiety|Mood|Inflammation|Muscle pain|Pain|Skin Care|Stress",Anytime,THC|CBD,,Low,,,,,,,,3,1,,1,1,1,None,,,,"Remedy CBD Oil can topically treat skin issues, help with mood, and relieve inflammation.","<p>With a 50:1 CBD:THC ratio, the Remedy Oil’s approximate 20 mg THC per bottle provides the perfect ensemble effect for those steering away from a THC effect. Just one single drop of The Remedy is a 2 mg CBD serving.</p>","<p>Sweet almond-oil based and cinnamon-flavored, Mary's 500 mg CBD Remedy Oil is a unique and concentrated sublingual option. Containing 250 servings, The Remedy is one of, if not the most, concentrated and cost-effective CBD options on the market. For these reasons, the Remedy Oil is an optimal recommendation for people that are using cannabis daily or who are looking to begin a regimen. To realize a cannabinoid’s full effects on the body, one must use daily for at least 30 days. The Remedy Oil provides close to four months of daily servings of CBD.
Averaging a 50:1 CBD:THC ratio, the Remedy Oil’s approximate 20 mg THC per bottle provides the perfect ensemble effect for those steering away from a THC effect. Just one single drop of The Remedy is a 2 mg CBD serving.</p>
<p>Mary's uses ingredients with intent. Sweet almond oil is rich in omega and oleic fatty acids, which translates as higher cannabinoid content having an effect on the body. Products like Mary's with high bioavailability, or absorption, allow for consumers to use less cannabis to reach the same desired effect, and keep tolerances and budgets managed. Cinnamon leaf and myrrh oils maintain many of their own health benefits.</p>
<p>The Remedy Oil has reportedly been used to topically relieve skin issues such as rosacea, psoriasis and eczema. It has been reported that customers also experienced relief from symptoms of gastrointestinal issues, as well as relief from symptoms of depression, inflammation, and pain.</p>
<p>Vegan and sugar-free. No MCT or coconut oil.</p>","<p>Sweet almond oil, cinnamon bark oil, cinnamon leaf oil, myrrh oil, cannabis extract.</p>","<p>Approximately 500 mg CBD per container, THC content varies slightly between 10-20 mg. 2 mg CBD per single drop.
Place one to two drops under the tongue as needed.</p>",https://images.ctfassets.net/4a6u5f7bz40f/2VlpKtCLcZkOBaf5aATn3e/02601d9d9165f3d9706bb4526d2e3e8a/MM_Remedy.jpg,https://images.ctfassets.net/4a6u5f7bz40f/2VlpKtCLcZkOBaf5aATn3e/02601d9d9165f3d9706bb4526d2e3e8a/MM_Remedy.jpg,https://images.ctfassets.net/4a6u5f7bz40f/2VlpKtCLcZkOBaf5aATn3e/02601d9d9165f3d9706bb4526d2e3e8a/MM_Remedy.jpg,,"Mary's Medicinals - The Remedy CBD Oil",
SEBAPRO1,,Topicals,simple,"Shop/Products/Rub/Topicals,Shop/Explore/Cannabinoids/THC,Shop/Explore/Strain/Sativa,Shop/Explore/Helps With/Mood,Shop/Explore/Helps With/Energy,Shop/Explore/Helps With/Headache,Shop/Explore/Helps With/Muscle pain,Shop/Explore/Helps With/Nerve pain,Shop/Explore/Helps With/Pain,Shop/Explore/Helps With/Stress,Shop/Explore/Helps With/Creativity,Shop/Explore/Helps With/Focus,Shop/Explore/Helps With/Energizing,Shop/Explore/Feeling/Daytime,Shop/Explore/High/Low",base,"Sativa Transdermal Gel Pen",,1,,"Catalog, Search",44,,marys-medicinals-sativa-transdermal-gel-pen,"Mary's Medicinals",Sativa,Topical,"Mood|Energy|Headache|Muscle pain|Nerve pain|Pain|Stress|Creativity|Focus|Energizing",Daytime,THC,,Low,,,,,,,,1,1,,1,1,1,None,,,,"Sativa Gel Pen with uplifting cerebral effects. Great for creativity, energy, and focus.","<p>Recommended for users looking for potential relief from issues such as panic attacks, migraine onset, or muscle tremors. inconspicuous, extremely fast-acting, and great for on-the-go use.</p>","<p>Sativa Gel Pen with uplifting cerebral effects. Great for creativity, energy, and focus.
Mary's Gel Pens are a U.S. patented cannabinoid product, providing the fastest onset of any cannabis product beyond inhale-ables. A simple dose per pump application of the cream-like consistency acts within 5-10 minutes and provides a 4-6 hour systemic effect. Subtle floral, citrus or menthol scent.
The Gel Pens are one of the most unique cannabis products on the market, and thus require more than typical consumer guidance on the retail end. Mary’s Gel Pens, being offered in THC, CBD and CBN profiles offer a product for almost every consumer. The Gels are inconspicuous, extremely fast-acting, and great for on-the-go use.</p>
<p>Gel Pens could be recommended to users looking for potential relief from quickly escalating issues such as panic attacks, migraine onset, epilepsy, or tremors. Mary’s Gel Pens should be applied to areas of clean, thin, venous skin like the inner wrist or top of the foot for a full body effect. Some users have also reported positive effects for headaches and migraines when applying Mary’s Transdermal Gel Pens to the forehead/temple or back of the ear areas.</p>","<p>VersaPro, Cannabis Extract, Menthol, Natural Fragrance, Isopropyl Myristate, Natural Terpenes.</p>","<p>Each Gel Pen contains approximately 200 mg of THC with each dose pump containing approximately 4 mg. Begin with one pump, wait 5-15 minutes for uptake and titrate as needed. 4-6 hour duration of effect.
Uncap the Gel Pen to reveal dispenser end. Gently twist the other end of the Gel Pen to unlock. Gently push down on button to dispense one pump, which is one dose. Gel should be put on the inner wrist, top of the foot or back of the knee for systemic application. Twist button end of the Gel Pen to lock while not in use.</p>",https://images.ctfassets.net/4a6u5f7bz40f/1oCSzVpMwwd06eHpibUOcY/70dee44b2c21bfd52503ab4aca55369e/MM_Pen_THC_Sativa.jpg,https://images.ctfassets.net/4a6u5f7bz40f/1oCSzVpMwwd06eHpibUOcY/70dee44b2c21bfd52503ab4aca55369e/MM_Pen_THC_Sativa.jpg,https://images.ctfassets.net/4a6u5f7bz40f/1oCSzVpMwwd06eHpibUOcY/70dee44b2c21bfd52503ab4aca55369e/MM_Pen_THC_Sativa.jpg,,"Mary's Medicinals - Sativa Transdermal Gel Pen",
